{
  "scenarioId": "baseline-week",
  "name": "Baseline weekly planning",
  "description": "Synthetic source-system-shaped maintenance events for a small weekly planning review.",
  "schemaVersion": "1.0",
  "seed": "baseline-week:2026-01-15:contract-1",
  "referenceTimeUtc": "2026-01-15T00:00:00Z",
  "sourceSystem": "synthetic-source",
  "apiImport": {
    "endpoint": "/api/v1/imports/maintenance-events",
    "importKind": "maintenance-events",
    "batchIdempotencyKey": "baseline-week-2026-01-15-contract-1"
  },
  "planningHorizon": {
    "startUtc": "2026-01-16T00:00:00Z",
    "endUtc": "2026-01-30T00:00:00Z"
  },
  "events": [
    {
      "eventId": "evt-baseline-week-0001",
      "eventType": "WorkOrderCreated",
      "schemaVersion": "1.0",
      "sourceSystem": "synthetic-source",
      "sourceRecordId": "WO-2000",
      "correlationId": "corr-baseline-week-0001",
      "occurredAt": "2026-01-15T00:01:00Z",
      "publishedAt": "2026-01-15T00:01:15Z",
      "idempotencyKey": "baseline-week:WO-2000:create:2026-01-15T00:01:00Z",
      "payload": {
        "sourceSystem": "synthetic-source",
        "sourceId": "WO-2000",
        "workOrderNumber": "WO-2000",
        "title": "Replace pump seals",
        "workType": "corrective",
        "priority": "high",
        "lifecycleStatus": "ReadyForPlanning",
        "assetSourceId": "ASSET-2000",
        "functionalLocationSourceId": "FL-2000",
        "requiredStartUtc": "2026-01-20T00:00:00Z",
        "dueAtUtc": "2026-01-24T00:00:00Z",
        "scheduledStartUtc": null,
        "estimatedHours": 8.5,
        "sourceUpdatedAtUtc": "2026-01-15T00:00:00Z",
        "sourceDataReadiness": {
          "status": "Ready",
          "validationIssues": []
        },
        "validationIssues": []
      },
      "expectation": {
        "importDisposition": "accepted",
        "readiness": "Ready"
      }
    },
    {
      "eventId": "evt-baseline-week-0002",
      "eventType": "WorkOrderCreated",
      "schemaVersion": "1.0",
      "sourceSystem": "synthetic-source",
      "sourceRecordId": "WO-2001",
      "correlationId": "corr-baseline-week-0002",
      "occurredAt": "2026-01-15T00:02:00Z",
      "publishedAt": "2026-01-15T00:02:12Z",
      "idempotencyKey": "baseline-week:WO-2001:create:2026-01-15T00:02:00Z",
      "payload": {
        "sourceSystem": "synthetic-source",
        "sourceId": "WO-2001",
        "workOrderNumber": "WO-2001",
        "title": "Inspect standby valve",
        "workType": "preventive",
        "priority": "medium",
        "lifecycleStatus": "Imported",
        "assetSourceId": "ASSET-2001",
        "functionalLocationSourceId": "FL-2000",
        "requiredStartUtc": "2026-01-22T00:00:00Z",
        "dueAtUtc": "2026-01-29T00:00:00Z",
        "scheduledStartUtc": null,
        "estimatedHours": null,
        "sourceUpdatedAtUtc": "2026-01-15T00:01:00Z",
        "sourceDataReadiness": {
          "status": "Blocked",
          "issueCode": "missing-estimate",
          "issueDetail": "Estimated effort is required before packaging.",
          "validationIssues": [
            {
              "code": "missing-estimate",
              "severity": "warning",
              "sourceField": "estimatedHours",
              "detail": "Estimated effort is not present in the source event."
            }
          ]
        },
        "validationIssues": [
          {
            "code": "missing-estimate",
            "severity": "warning",
            "sourceField": "estimatedHours",
            "detail": "Estimated effort is not present in the source event."
          }
        ]
      },
      "expectation": {
        "importDisposition": "accepted-blocked",
        "readiness": "Blocked",
        "validationIssues": [
          {
            "code": "missing-estimate",
            "severity": "warning",
            "sourceField": "estimatedHours",
            "detail": "Accepted for review, but blocked from packaging."
          }
        ]
      }
    },
    {
      "eventId": "evt-baseline-week-0003",
      "eventType": "WorkOrderCreated",
      "schemaVersion": "1.0",
      "sourceSystem": "synthetic-source",
      "sourceRecordId": "WO-2002",
      "correlationId": "corr-baseline-week-0003",
      "occurredAt": "2026-01-15T00:03:00Z",
      "publishedAt": "2026-01-15T00:03:12Z",
      "idempotencyKey": "baseline-week:WO-2002:create:2026-01-15T00:03:00Z",
      "payload": {
        "sourceSystem": "synthetic-source",
        "sourceId": "WO-2002",
        "workOrderNumber": "WO-2002",
        "title": "Check auxiliary drive",
        "workType": "inspection",
        "priority": "medium",
        "lifecycleStatus": "Imported",
        "assetSourceId": "ASSET-2002",
        "functionalLocationSourceId": null,
        "requiredStartUtc": "2026-01-23T00:00:00Z",
        "dueAtUtc": "2026-01-28T00:00:00Z",
        "scheduledStartUtc": null,
        "estimatedHours": 4,
        "sourceUpdatedAtUtc": "2026-01-15T00:02:00Z",
        "sourceDataReadiness": {
          "status": "Blocked",
          "issueCode": "missing-functional-location",
          "issueDetail": "Functional location is required before the event can be accepted.",
          "validationIssues": [
            {
              "code": "missing-functional-location",
              "severity": "error",
              "sourceField": "functionalLocationSourceId",
              "detail": "Functional location source id is not present."
            }
          ]
        },
        "validationIssues": [
          {
            "code": "missing-functional-location",
            "severity": "error",
            "sourceField": "functionalLocationSourceId",
            "detail": "Functional location source id is not present."
          }
        ]
      },
      "expectation": {
        "importDisposition": "rejected",
        "readiness": "Blocked",
        "validationIssues": [
          {
            "code": "missing-functional-location",
            "severity": "error",
            "sourceField": "functionalLocationSourceId",
            "detail": "Rejected before import because a required source field is missing."
          }
        ]
      }
    },
    {
      "eventId": "evt-baseline-week-0004",
      "eventType": "WorkOrderUpdated",
      "schemaVersion": "1.0",
      "sourceSystem": "synthetic-source",
      "sourceRecordId": "WO-2000",
      "correlationId": "corr-baseline-week-0004",
      "occurredAt": "2026-01-15T00:04:00Z",
      "publishedAt": "2026-01-15T00:04:11Z",
      "idempotencyKey": "baseline-week:WO-2000:update:stale:2026-01-15T00:04:00Z",
      "payload": {
        "sourceSystem": "synthetic-source",
        "sourceId": "WO-2000",
        "workOrderNumber": "WO-2000",
        "title": "Replace pump seals",
        "workType": "corrective",
        "priority": "medium",
        "lifecycleStatus": "ReadyForPlanning",
        "assetSourceId": "ASSET-2000",
        "functionalLocationSourceId": "FL-2000",
        "requiredStartUtc": "2026-01-20T00:00:00Z",
        "dueAtUtc": "2026-01-25T00:00:00Z",
        "scheduledStartUtc": null,
        "estimatedHours": 8.5,
        "sourceUpdatedAtUtc": "2026-01-14T23:50:00Z",
        "sourceDataReadiness": {
          "status": "Ready",
          "validationIssues": []
        },
        "validationIssues": []
      },
      "expectation": {
        "importDisposition": "ignored-stale",
        "readiness": "Ready",
        "reason": "Older source update should not replace the accepted work order state."
      }
    },
    {
      "eventId": "evt-baseline-week-0005",
      "eventType": "WorkOrderCreated",
      "schemaVersion": "1.0",
      "sourceSystem": "synthetic-source",
      "sourceRecordId": "WO-2000",
      "correlationId": "corr-baseline-week-0005",
      "occurredAt": "2026-01-15T00:05:00Z",
      "publishedAt": "2026-01-15T00:05:10Z",
      "idempotencyKey": "baseline-week:WO-2000:create:2026-01-15T00:01:00Z",
      "payload": {
        "sourceSystem": "synthetic-source",
        "sourceId": "WO-2000",
        "workOrderNumber": "WO-2000",
        "title": "Replace pump seals",
        "workType": "corrective",
        "priority": "high",
        "lifecycleStatus": "ReadyForPlanning",
        "assetSourceId": "ASSET-2000",
        "functionalLocationSourceId": "FL-2000",
        "requiredStartUtc": "2026-01-20T00:00:00Z",
        "dueAtUtc": "2026-01-24T00:00:00Z",
        "scheduledStartUtc": null,
        "estimatedHours": 8.5,
        "sourceUpdatedAtUtc": "2026-01-15T00:00:00Z",
        "sourceDataReadiness": {
          "status": "Ready",
          "validationIssues": []
        },
        "validationIssues": []
      },
      "expectation": {
        "importDisposition": "ignored-duplicate",
        "readiness": "Ready",
        "reason": "Repeated idempotency key should be ignored by import processing."
      }
    },
    {
      "eventId": "evt-baseline-week-0006",
      "eventType": "WorkOrderStatusChanged",
      "schemaVersion": "1.0",
      "sourceSystem": "synthetic-source",
      "sourceRecordId": "WO-2001",
      "correlationId": "corr-baseline-week-0006",
      "occurredAt": "2026-01-15T00:06:00Z",
      "publishedAt": "2026-01-15T00:06:14Z",
      "idempotencyKey": "baseline-week:WO-2001:status:2026-01-15T00:06:00Z",
      "payload": {
        "sourceSystem": "synthetic-source",
        "sourceId": "WO-2001",
        "workOrderNumber": "WO-2001",
        "title": "Inspect standby valve",
        "workType": "preventive",
        "priority": "medium",
        "lifecycleStatus": "Imported",
        "assetSourceId": "ASSET-2001",
        "functionalLocationSourceId": "FL-2000",
        "requiredStartUtc": "2026-01-22T00:00:00Z",
        "dueAtUtc": "2026-01-29T00:00:00Z",
        "scheduledStartUtc": null,
        "estimatedHours": null,
        "sourceUpdatedAtUtc": "2026-01-15T00:06:00Z",
        "sourceDataReadiness": {
          "status": "Blocked",
          "issueCode": "missing-estimate",